### ISSUE TITLE
The SSE transport not working

### ISSUE THREAD

**Issue by benoysaha** [kaeawc/android-mcp-sdk#28]
I tried to use this code for running MCP server on Android.

Steps -

1. Installed Sample Android MCP APK in Android phone - It started correctly
2. Executed the script scripts/adb_testing/setup_port_forwarding.sh   ---- Here is the output

_Setting up ADB port forwarding for Android MCP SDK...
adb server version (41) doesn't match this client (39); killing...
* daemon started successfully
Setting up port forwarding...
Forwarding SSE port: 8080
Port forwarding setup complete!
Verifying port forwarding...
RZCW31SGFYD tcp:8080 tcp:8080
✓ Port forwarding verified
Testing connectivity...
✓ HTTP/SSE endpoint accessible

ADB port forwarding setup complete!
SSE endpoint: http://localhost:8080/mcp

Next steps:
1. Launch your Android app with MCP server
2. Connect MCP clients to: http://localhost:8080/mcp___

Now tried to connect to the MCP server from workstation using the below code snippet

        server_url = "http://localhost:8080/mcp"
        async with sse_client(url=server_url) as streams:
            print("connected")
            async with ClientSession(streams[0], streams[1]) as session:
                await session.initialize()
                print("Connected to MCP server at", server_url)
                tools = await session.list_tools()
                print (tools)
                print(f"Available tools: {[tool.name for tool in tools.tools]}")

The connection is not successful. Please find the tcpdump from the workstation -

benoy@benoy-laptop:~/MCP/MCP_SDK_ANDROID/android-mcp-sdk-main$ sudo tcpdump -i lo port 8080
[sudo] password for benoy: 
tcpdump: verbose output suppressed, use -v or -vv for full protocol decode
listening on lo, link-type EN10MB (Ethernet), capture size 262144 bytes

17:12:04.345779 IP localhost.43784 > localhost.http-alt: Flags [S], seq 1117200702, win 65495, options [mss 65495,sackOK,TS val 3401768703 ecr 0,nop,wscale 7], length 0
17:12:04.345791 IP localhost.http-alt > localhost.43784: Flags [S.], seq 2111368598, ack 1117200703, win 65483, options [mss 65495,sackOK,TS val 3401768703 ecr 3401768703,nop,wscale 7], length 0
17:12:04.345800 IP localhost.43784 > localhost.http-alt: Flags [.], ack 1, win 512, options [nop,nop,TS val 3401768703 ecr 3401768703], length 0
17:12:04.346219 IP localhost.43784 > localhost.http-alt: Flags [P.], seq 1:185, ack 1, win 512, options [nop,nop,TS val 3401768703 ecr 3401768703], length 184: HTTP: GET /mcp HTTP/1.1
17:12:04.346224 IP localhost.http-alt > localhost.43784: Flags [.], ack 185, win 511, options [nop,nop,TS val 3401768703 ecr 3401768703], length 0

17:14:21.123452 IP localhost.http-alt > localhost.43784: Flags [P.], seq 1:70, ack 185, win 512, options [nop,nop,TS val 3401905481 ecr 3401768703], length 69: HTTP: HTTP/1.1 404 Not Found
17:14:21.123463 IP localhost.43784 > localhost.http-alt: Flags [.], ack 70, win 512, options [nop,nop,TS val 3401905481 ecr 3401905481], length 0
17:14:21.124608 IP localhost.43784 > localhost.http-alt: Flags [F.], seq 185, ack 70, win 512, options [nop,nop,TS val 3401905482 ecr 3401905481], length 0
17:14:21.124787 IP localhost.http-alt > localhost.43784: Flags [F.], seq 70, ack 186, win 512, options [nop,nop,TS val 3401905482 ecr 3401905482], length 0
17:14:21.124801 IP localhost.43784 > localhost.http-alt: Flags [.], ack 71, win 512, options [nop,nop,TS val 3401905482 ecr 3401905482], length 0

Could you please check the issue

**Comment by kaeawc** [comment]
Thanks for the bug report, I'll look into it

**Comment by 7atech** [comment]
facing the same pb any fix ?
